{
  "version": "v0",
  "message_id": "0195f66a-0e14-7f0f-a5aa-0d7f3b6f08c1",
  "sender_spiffe_id": "spiffe://mesh/ns-a/service-a",
  "recipient_spiffe_id": "spiffe://mesh/ns-b/service-b",
  "issued_at": "2026-04-14T12:00:00Z",
  "expires_at": "2026-04-14T12:05:00Z",
  "nonce": "nonce-000000000001",
  "capability_token": "cap-token-1",
  "purpose_of_use": "invoke_tool",
  "kid": "dev-kid-1",
  "alg": "Ed25519",
  "payload": {
    "tool": "ping",
    "args": {
      "target": "node-1"
    }
  },
  "payload_digest": "94fabd33a2221b6d3986e8d5ba98d75a91dcdad9b978ac7ea70bbc996fb2bb45",
  "signature": "kr9Yr3ei5JPeUpnnwat8GYcWMbfsLZs4onOD0l-r1StV78FzFtLNxiMxHTb9rL8TI9-jIY2Mm7x9FdWDYIYfCg"
}
